{
  "schema_version": "1.0.0",
  "case_id": "a05a7dd1-5897-5631-8a1a-1995d00facf3",
  "revision": 5,
  "created_at": "2026-09-20T02:00:00+05:30",
  "case_status": "routed_for_diagnostics",
  "patient": {
    "demographics": {
      "age": 35,
      "sex": "male",
      "location": "DEMO-AREA-A"
    },
    "patient_ref": "DEMO-PATIENT-003"
  },
  "consent": {
    "data_collection": true,
    "share_with_verifier": true,
    "audio_recording": false,
    "recorded_at": "2026-09-20T01:59:00+05:30"
  },
  "symptom_screen": {
    "cough_present": true,
    "cough_duration_days": 4,
    "fever": true,
    "night_sweats": null,
    "weight_loss": false,
    "source": "text",
    "raw_transcript": null,
    "structured_at": "2026-09-20T02:00:00+05:30"
  },
  "xray": {
    "available": true,
    "image_ref": "synthetic://cxr/03",
    "model_flag": null,
    "model_confidence": null,
    "heatmap_ref": null,
    "model_id": null,
    "captured_at": "2026-09-20T03:40:00+05:30"
  },
  "esr": {
    "available": false,
    "value": null,
    "flag": null,
    "reference_range_used": null,
    "captured_at": null
  },
  "case_summary": {
    "brief_text": null,
    "generated_at": null
  },
  "review_history": [
    {
      "review_id": "94fc1ef9-c0ad-5752-9d22-dddd378f8c32",
      "reviewer_id": "demo-verifier-1",
      "reviewer_role": "verifier",
      "decision": "more_tests_needed",
      "requested_tests": [
        "xray"
      ],
      "notes": "Additional X-ray requested; absence must not block clinically indicated NAAT referral.",
      "decided_at": "2026-09-20T02:15:00+05:30"
    },
    {
      "review_id": "9d40b0a7-22af-5a61-be3a-0c8208cd52c8",
      "reviewer_id": "demo-verifier-1",
      "reviewer_role": "verifier",
      "decision": "intervention_required",
      "requested_tests": [],
      "notes": "Refer for clinician-directed molecular diagnostic testing; no TB diagnosis yet.",
      "decided_at": "2026-09-20T03:55:00+05:30"
    }
  ],
  "routes": [
    {
      "route_id": "ebf9a3ea-6bdd-5189-874b-6dc6b92d4cce",
      "purpose": "additional_screening",
      "site_id": "DEMO-XRAY-VAN",
      "status": "completed",
      "routed_at": "2026-09-20T02:18:00+05:30"
    },
    {
      "route_id": "833e4676-ec29-598f-bc30-c7775beba699",
      "purpose": "diagnostic_testing",
      "site_id": "DEMO-NAAT-LAB",
      "status": "planned",
      "routed_at": "2026-09-20T03:57:00+05:30"
    }
  ],
  "diagnostic_tests": [
    {
      "test_id": "c8e3a9ca-049c-5ae6-bc8e-46c099715c29",
      "test_type": "xpert_ultra",
      "result": "pending",
      "lab_id": "DEMO-NAAT-LAB",
      "specimen_ref": null,
      "collected_at": null,
      "result_at": null
    }
  ],
  "diagnosis": null,
  "asha_assignment": {
    "asha_id": "DEMO-ASHA-1",
    "assigned_at": "2026-09-20T04:01:00+05:30",
    "support_phase": "pre_diagnosis_navigation",
    "medicine_pickup_log": []
  },
  "followups": [
    {
      "date": "2026-09-20T04:10:00+05:30",
      "kind": "navigation",
      "source": "text",
      "raw_transcript": null,
      "summary": "Synthetic assistance arranging transport to sample-collection site.",
      "trend": null
    }
  ],
  "status_history": [
    {
      "from": null,
      "to": "intake",
      "at": "2026-09-20T02:00:00+05:30",
      "actor_id": "demo-pharmacist-1",
      "actor_role": "pharmacist"
    },
    {
      "from": "intake",
      "to": "ready_for_review",
      "at": "2026-09-20T02:03:00+05:30",
      "actor_id": "demo-pharmacist-1",
      "actor_role": "pharmacist"
    },
    {
      "from": "ready_for_review",
      "to": "pending_additional_test",
      "at": "2026-09-20T02:15:00+05:30",
      "actor_id": "demo-verifier-1",
      "actor_role": "verifier"
    },
    {
      "from": "pending_additional_test",
      "to": "ready_for_review",
      "at": "2026-09-20T03:41:00+05:30",
      "actor_id": "demo-pharmacist-1",
      "actor_role": "pharmacist"
    },
    {
      "from": "ready_for_review",
      "to": "routed_for_diagnostics",
      "at": "2026-09-20T03:56:00+05:30",
      "actor_id": "demo-verifier-1",
      "actor_role": "verifier"
    }
  ]
}
